{
  "schemaVersion": "1.0",
  "tenant": {
    "tenantName": "REQUIRES_TENANT_DISCOVERY",
    "tenantId": "REQUIRES_TENANT_DISCOVERY",
    "sharePointAdminUrl": "REQUIRES_TENANT_DISCOVERY",
    "contentTypeHubUrl": "REQUIRES_TENANT_DISCOVERY",
    "defaultTimeZone": "Europe/London",
    "defaultLanguage": "en-GB",
    "auditRetentionDays": 180
  },
  "environments": {
    "dev": {
      "environmentType": "dev",
      "dmsSiteUrl": "REQUIRES_TENANT_DISCOVERY",
      "powerPlatformEnvironmentUrl": "REQUIRES_TENANT_DISCOVERY",
      "powerPlatformEnvironmentId": "REQUIRES_TENANT_DISCOVERY",
      "pilotBusinessUnit": "REQUIRES_STAKEHOLDER_DECISION_OQ-04",
      "allowProductionChanges": false,
      "allowIrreversiblePurviewChanges": false,
      "operatingMode": "ControlledAuthoring",
      "externalSharing": "Disabled",
      "staleCheckOutThresholdBusinessDays": 3,
      "entraGroupPrefix": "DMS-DEV",
      "requiresApprovalToDeploy": false,
      "entraClientId": "REQUIRES_TENANT_DISCOVERY"
    },
    "test": {
      "environmentType": "test",
      "dmsSiteUrl": "REQUIRES_TENANT_DISCOVERY",
      "powerPlatformEnvironmentUrl": "REQUIRES_TENANT_DISCOVERY",
      "powerPlatformEnvironmentId": "REQUIRES_TENANT_DISCOVERY",
      "pilotBusinessUnit": "REQUIRES_STAKEHOLDER_DECISION_OQ-04",
      "allowProductionChanges": false,
      "allowIrreversiblePurviewChanges": false,
      "operatingMode": "ControlledAuthoring",
      "externalSharing": "Disabled",
      "staleCheckOutThresholdBusinessDays": 3,
      "entraGroupPrefix": "DMS-TEST",
      "requiresApprovalToDeploy": true,
      "entraClientId": "REQUIRES_TENANT_DISCOVERY"
    },
    "prod": {
      "environmentType": "prod",
      "dmsSiteUrl": "REQUIRES_TENANT_DISCOVERY",
      "powerPlatformEnvironmentUrl": "REQUIRES_TENANT_DISCOVERY",
      "powerPlatformEnvironmentId": "REQUIRES_TENANT_DISCOVERY",
      "pilotBusinessUnit": "REQUIRES_STAKEHOLDER_DECISION_OQ-04",
      "allowProductionChanges": false,
      "allowIrreversiblePurviewChanges": false,
      "operatingMode": "ControlledAuthoring",
      "externalSharing": "Disabled",
      "staleCheckOutThresholdBusinessDays": 3,
      "entraGroupPrefix": "DMS",
      "requiresApprovalToDeploy": true,
      "entraClientId": "REQUIRES_TENANT_DISCOVERY"
    }
  },
  "provisional": [
    {
      "setting": "tenant.auditRetentionDays",
      "openQuestion": "OQ-07",
      "provisionalValue": "180",
      "risk": "Purview Audit Standard retains audit records for a documented default period. If the approved evidence period is longer, audit licensing must be confirmed or evidence must rely on the Approval Evidence register (PRD F-010, NFR-012, R-12)."
    },
    {
      "setting": "environments.*.operatingMode",
      "openQuestion": "OQ-05",
      "provisionalValue": "ControlledAuthoring (single-library pattern, ADR-001 Option A)",
      "risk": "If Quality/Legal require every approved revision to be a separate immutable artefact, the Published Revisions library pattern must be enabled before production content is created (PRD F-013, R-20)."
    },
    {
      "setting": "environments.*.staleCheckOutThresholdBusinessDays",
      "openQuestion": "OQ-18",
      "provisionalValue": "3",
      "risk": "PRD MET-008 states an initial threshold of 3 business days. Confirm against agreed operating hours before pilot acceptance."
    },
    {
      "setting": "tenant.defaultTimeZone",
      "openQuestion": "OQ-16",
      "provisionalValue": "Europe/London",
      "risk": "PRD A-005 assumes a single primary operating timezone. Multi-region operation changes due-date calculation and business-calendar treatment."
    }
  ]
}